{
  "category": "missing-functionality",
  "created_at": "2026-08-13T13:04:16Z",
  "id": "note-a592cc85b2f3",
  "reference_id": "component-look-6013004ba32c",
  "schema_version": 1,
  "stage": "workflow",
  "text": "and we should have a quick way to kick off a motion test, some sort of wireframe or flat shaded viewport render or some vary fast way to view motion. this can be in any phase that things are updated before rendering",
  "track": "cinematography",
  "visibility": "private"
}
