{
  "category": "missing-functionality",
  "created_at": "2026-08-13T13:02:27Z",
  "id": "note-82bdca4a37bb",
  "reference_id": "component-look-6013004ba32c",
  "schema_version": 1,
  "stage": "look",
  "text": "also the look dev process should allow for both sweeping changes and small quick nitpicky iterative revisions (probably just on one frame)",
  "track": "look",
  "visibility": "private"
}
