{
  "category": "working",
  "created_at": "2026-08-13T12:52:56Z",
  "id": "note-2b6a2c9410ed",
  "reference_id": "component-look-6013004ba32c",
  "schema_version": 1,
  "stage": "look",
  "text": "Conversational iterative look development using cheap one-frame probes made precise visual refinement fast and easy to evaluate.",
  "track": "look",
  "visibility": "private"
}
