{
  "category": "working",
  "created_at": "2026-08-15T20:37:06Z",
  "id": "note-106573aeaa08",
  "reference_id": "artifact-pilot-study-003-faithful-v1",
  "schema_version": 1,
  "stage": "behavior",
  "text": "KC review: the faithful Study 003 motion check works and looks very similar to Simon Woods's reference, though it feels less frenetic. Treat this as positive fidelity evidence and retain the energy difference for diagnosis before formal behavior promotion.",
  "track": "behavior",
  "visibility": "private"
}
