{
  "category": "pain-point",
  "created_at": "2026-08-13T12:52:56Z",
  "id": "note-b70873e29b0e",
  "reference_id": "component-look-6013004ba32c",
  "schema_version": 1,
  "stage": "look",
  "text": "Static final-state Look probes were too basic to critique before the moving simulation elements and underlying memory field were explained.",
  "track": "look",
  "visibility": "private"
}
