{
  "category": "working",
  "created_at": "2026-08-15T19:14:08Z",
  "id": "note-8bca6c3ed1e8",
  "reference_id": "artifact-pilot-study-003-faithful-v1",
  "schema_version": 1,
  "stage": "behavior",
  "text": "The faithful 1,000-point VEX baseline passed the short-horizon parity tracer and the 240-step step-scaled tolerance. Long-horizon float32 drift is reported explicitly rather than described as exact numerical parity; graph indices remained identical and no VEX errors occurred.",
  "track": "behavior",
  "visibility": "private"
}
