{
  "category": "idea",
  "created_at": "2026-08-13T12:59:48Z",
  "id": "note-445dedca38d2",
  "reference_id": "component-look-6013004ba32c",
  "schema_version": 1,
  "stage": "probe",
  "text": "exactly. this allows us to come back and revisit different directions after the look dev is done, as some of those might lend themselves better to where we ended up look wise.",
  "track": "behavior",
  "visibility": "private"
}
