{
  "category": "pain-point",
  "created_at": "2026-08-13T13:01:03Z",
  "id": "note-2ccaa593afb8",
  "reference_id": "component-look-6013004ba32c",
  "schema_version": 1,
  "stage": "workflow",
  "text": "probably the biggest pain point is just rooting through the directories trying to find each of the images/.mp4s to review. this will obviously be sorted once we have an interface, but thought I'd bring it up",
  "track": "field-station",
  "visibility": "private"
}
