{
  "category": "pain-point",
  "created_at": "2026-08-13T16:39:47Z",
  "id": "note-a670b94fa83e",
  "reference_id": "component-look-6013004ba32c",
  "schema_version": 1,
  "stage": "workflow",
  "text": "when I open the .hip files the nodes are all on top of each other, could use a quick cleanup/organization if possible",
  "track": "look",
  "visibility": "private"
}
