{
  "category": "missing-functionality",
  "created_at": "2026-08-13T12:52:55Z",
  "id": "note-5a124728fee9",
  "reference_id": "component-look-6013004ba32c",
  "schema_version": 1,
  "stage": "workflow",
  "text": "Create a lightweight way to capture what is working, pain points, questions, and desired functionality at each Studio step while the experience is fresh.",
  "track": "field-station",
  "visibility": "private"
}
